{
  "schema_version": "1.0.0",
  "task_id": "review-001",
  "status": "accepted",
  "reviewed_outputs": [
    "schemas/goal_contract.schema.json",
    "schemas/review_report.schema.json",
    "schemas/worker_report.schema.json",
    "schemas/delegation_contract.schema.json",
    "schemas/lifecycle_event.schema.json",
    "schemas/runner_policy.schema.json",
    "schemas/run_state.schema.json",
    "examples/goal_contract.valid.json",
    "examples/review_report.valid.json",
    "examples/lifecycle_log.jsonl"
  ],
  "scope_check": {
    "status": "passed",
    "evidence": "Reviewed outputs are within the schema and example artifact scope.",
    "findings": []
  },
  "goal_contract_check": {
    "status": "passed",
    "evidence": "Required Goal Contract fields and hard gate concepts are represented.",
    "findings": []
  },
  "overall_completion_score": 92,
  "rubric_scores": {
    "question_fulfillment": {
      "score": 23,
      "max_score": 25,
      "evidence": "The request for scored goal completion, scenario flow, and hard gates is covered."
    },
    "functional_completeness": {
      "score": 18,
      "max_score": 20,
      "evidence": "All planned schema and example artifacts exist."
    },
    "scenario_flow_coverage": {
      "score": 28,
      "max_score": 30,
      "evidence": "Goal-to-review and close-audit flows are covered."
    },
    "edge_case_handling": {
      "score": 8,
      "max_score": 10,
      "evidence": "Hard gate failures are represented."
    },
    "regression_safety": {
      "score": 5,
      "max_score": 5,
      "evidence": "Existing main-session delegation rules are preserved."
    },
    "verification_completeness": {
      "score": 10,
      "max_score": 10,
      "evidence": "Syntax validation evidence is available; lockfile-backed schema validation is future runner evidence."
    }
  },
  "scenario_flow_scores": [
    {
      "id": "flow-goal-to-review-loop",
      "score": 92,
      "passed": true,
      "evidence": "The loop requires score >= 85, passed_threshold true, and empty blocking_gates."
    },
    {
      "id": "flow-close-audit",
      "score": 90,
      "passed": true,
      "evidence": "Lifecycle events and close audit terminal states are represented."
    }
  ],
  "score_threshold": 85,
  "passed_threshold": true,
  "blocking_gates": [],
  "verification_check": {
    "build": {
      "status": "not_applicable",
      "evidence": "No application build exists for docs/schema v1.",
      "findings": []
    },
    "lint": {
      "status": "passed",
      "evidence": "Markdown fence and key field checks passed.",
      "findings": []
    },
    "test": {
      "status": "passed",
      "evidence": "JSON/YAML syntax checks passed; schema validation requires a pinned dependency and lockfile-backed validator.",
      "findings": []
    },
    "run": {
      "status": "not_applicable",
      "evidence": "Runner execution is explicitly out of v1 scope.",
      "findings": []
    },
    "behavior_check": {
      "status": "passed",
      "evidence": "Delegation, scoring, rework, hard gate, and close audit behavior are documented.",
      "findings": []
    }
  },
  "security_check": {
    "status": "passed",
    "evidence": "No raw secrets, workspace escape, or unauthorized network/cost behavior is present.",
    "findings": []
  },
  "secret_scan_result": {
    "status": "passed",
    "evidence": "No secret candidates were found in examples.",
    "findings": []
  },
  "scope_diff_result": {
    "status": "passed",
    "evidence": "Changed artifacts are within the agreed docs/schema/example scope.",
    "findings": []
  },
  "command_audit": [
    {
      "command": "node -e <parse json/jsonl and markdown fence checks>; js-yaml@4.1.0 <policy yaml>",
      "cwd": "C:/Users/kcor2/Desktop/make_fun/make_harness",
      "purpose": "Validate artifact syntax without claiming executable runner validation.",
      "exit_code": 0,
      "output_summary": "All syntax checks passed."
    }
  ],
  "budget_used": {
    "iterations": 1,
    "rework_iterations": 0,
    "consensus_rounds": 2,
    "subagents_started": 4,
    "open_subagents": 0
  },
  "rework_items": [],
  "next_iteration_recommendation": "No rework required.",
  "risks_or_follow_up": [
    "The CLI is still a contract and not an executable implementation."
  ],
  "recommendation": "accepted"
}
